{
  "schema_version": 1,
  "research_case": "example_research",
  "case_id": "example_formatting",
  "content_mode": "layout_only",
  "entrypoint": "main.tex",
  "sources": [
    {
      "id": "user-main",
      "path": "inputs/main.tex",
      "format": "latex",
      "target": "main.tex"
    }
  ],
  "assets": []
}
